[I 2023-10-23 22:10:52,256] Trial 71 finished with value: 0.5806370377540588 and parameters: {'lr': 2.930792868424465e-07, 'n_estimators': 35, 'optimizer': 'Adam'}. Best is trial 70 with value: 0.5815342664718628.

Model Loaded.

Saving Model At: save_model/best_model.pth

Saving Model At: save_model/best_model.pth

Saving Model At: save_model/best_model.pth

Saving Model At: save_model/best_model.pth

Saving Model At: save_model/best_model.pth

Saving Model At: save_model/best_model.pth

Saving Model At: save_model/best_model.pth

Saving Model At: save_model/best_model.pth

Saving Model At: save_model/best_model.pth

Saving Model At: save_model/best_model.pth

Saving Model At: save_model/best_model.pth

Saving Model At: save_model/best_model.pth

Saving Model At: save_model/best_model.pth

Saving Model At: save_model/best_model.pth

Saving Model At: save_model/best_model.pth

Saving Model At: save_model/best_model.pth

Saving Model At: save_model/best_model.pth

Saving Model At: save_model/best_model.pth

Saving Model At: save_model/best_model.pth

Saving Model At: save_model/best_model.pth

Saving Model At: save_model/best_model.pth

Saving Model At: save_model/best_model.pth

Saving Model At: save_model/best_model.pth

Saving Model At: save_model/best_model.pth

Saving Model At: save_model/best_model.pth

Saving Model At: save_model/best_model.pth

Saving Model At: save_model/best_model.pth

Saving Model At: save_model/best_model.pth

Saving Model At: save_model/best_model.pth

Saving Model At: save_model/best_model.pth

Saving Model At: save_model/best_model.pth

Saving Model At: save_model/best_model.pth

Saving Model At: save_model/best_model.pth

Saving Model At: save_model/best_model.pth

Saving Model At: save_model/best_model.pth

Saving Model At: save_model/best_model.pth

Saving Model At: save_model/best_model.pth

Saving Model At: save_model/best_model.pth

Saving Model At: save_model/best_model.pth

Saving Model At: save_model/best_model.pth

Saving Model At: save_model/best_model.pth

Saving Model At: save_model/best_model.pth

Saving Model At: save_model/best_model.pth

Saving Model At: save_model/best_model.pth

Saving Model At: save_model/best_model.pth

Saving Model At: save_model/best_model.pth

Saving Model At: save_model/best_model.pth

Saving Model At: save_model/best_model.pth

Saving Model At: save_model/best_model.pth

Saving Model At: save_model/best_model.pth

Saving Model At: save_model/best_model.pth

Saving Model At: save_model/best_model.pth

Saving Model At: save_model/best_model.pth

Saving Model At: save_model/best_model.pth

Saving Model At: save_model/best_model.pth

Saving Model At: save_model/best_model.pth

Saving Model At: save_model/best_model.pth

Saving Model At: save_model/best_model.pth

Saving Model At: save_model/best_model.pth

Saving Model At: save_model/best_model.pth

Saving Model At: save_model/best_model.pth

Saving Model At: save_model/best_model.pth

Saving Model At: save_model/best_model.pth

Saving Model At: save_model/best_model.pth

Saving Model At: save_model/best_model.pth

Saving Model At: save_model/best_model.pth

Saving Model At: save_model/best_model.pth

Saving Model At: save_model/best_model.pth

Saving Model At: save_model/best_model.pth

Saving Model At: save_model/best_model.pth

Saving Model At: save_model/best_model.pth

Saving Model At: save_model/best_model.pth

Saving Model At: save_model/best_model.pth

Saving Model At: save_model/best_model.pth

Saving Model At: save_model/best_model.pth

Saving Model At: save_model/best_model.pth

Saving Model At: save_model/best_model.pth

Saving Model At: save_model/best_model.pth

Saving Model At: save_model/best_model.pth

Saving Model At: save_model/best_model.pth

Saving Model At: save_model/best_model.pth

Saving Model At: save_model/best_model.pth

Saving Model At: save_model/best_model.pth

Saving Model At: save_model/best_model.pth

Saving Model At: save_model/best_model.pth

Saving Model At: save_model/best_model.pth

Saving Model At: save_model/best_model.pth

Saving Model At: save_model/best_model.pth

Saving Model At: save_model/best_model.pth

Saving Model At: save_model/best_model.pth

Saving Model At: save_model/best_model.pth

Saving Model At: save_model/best_model.pth

Saving Model At: save_model/best_model.pth

Saving Model At: save_model/best_model.pth

Saving Model At: save_model/best_model.pth

Saving Model At: save_model/best_model.pth

Saving Model At: save_model/best_model.pth

Saving Model At: save_model/best_model.pth

Saving Model At: save_model/best_model.pth

Saving Model At: save_model/best_model.pth

Saving Model At: save_model/best_model.pth

Saving Model At: save_model/best_model.pth

Saving Model At: save_model/best_model.pth

Saving Model At: save_model/best_model.pth

Saving Model At: save_model/best_model.pth

Saving Model At: save_model/best_model.pth

Saving Model At: save_model/best_model.pth

Saving Model At: save_model/best_model.pth

Saving Model At: save_model/best_model.pth

Saving Model At: save_model/best_model.pth

Saving Model At: save_model/best_model.pth

Saving Model At: save_model/best_model.pth

Saving Model At: save_model/best_model.pth

Saving Model At: save_model/best_model.pth

Saving Model At: save_model/best_model.pth

Saving Model At: save_model/best_model.pth

Saving Model At: save_model/best_model.pth

Saving Model At: save_model/best_model.pth

Saving Model At: save_model/best_model.pth

Saving Model At: save_model/best_model.pth

Saving Model At: save_model/best_model.pth

Saving Model At: save_model/best_model.pth

Saving Model At: save_model/best_model.pth

Saving Model At: save_model/best_model.pth

Saving Model At: save_model/best_model.pth

Saving Model At: save_model/best_model.pth

Saving Model At: save_model/best_model.pth

Saving Model At: save_model/best_model.pth

Saving Model At: save_model/best_model.pth

Saving Model At: save_model/best_model.pth

Saving Model At: save_model/best_model.pth

Saving Model At: save_model/best_model.pth

Saving Model At: save_model/best_model.pth

Saving Model At: save_model/best_model.pth

Saving Model At: save_model/best_model.pth

Saving Model At: save_model/best_model.pth

Saving Model At: save_model/best_model.pth

Saving Model At: save_model/best_model.pth

Saving Model At: save_model/best_model.pth

Saving Model At: save_model/best_model.pth

Saving Model At: save_model/best_model.pth

Saving Model At: save_model/best_model.pth

Saving Model At: save_model/best_model.pth

Saving Model At: save_model/best_model.pth

Saving Model At: save_model/best_model.pth

Saving Model At: save_model/best_model.pth

Saving Model At: save_model/best_model.pth

Saving Model At: save_model/best_model.pth

Saving Model At: save_model/best_model.pth

Saving Model At: save_model/best_model.pth

Saving Model At: save_model/best_model.pth

Saving Model At: save_model/best_model.pth

Saving Model At: save_model/best_model.pth

Saving Model At: save_model/best_model.pth

Saving Model At: save_model/best_model.pth

Saving Model At: save_model/best_model.pth

Saving Model At: save_model/best_model.pth

Saving Model At: save_model/best_model.pth

Saving Model At: save_model/best_model.pth

Saving Model At: save_model/best_model.pth

Saving Model At: save_model/best_model.pth

Saving Model At: save_model/best_model.pth

Saving Model At: save_model/best_model.pth

Saving Model At: save_model/best_model.pth

Saving Model At: save_model/best_model.pth

Saving Model At: save_model/best_model.pth

Saving Model At: save_model/best_model.pth

Saving Model At: save_model/best_model.pth

Saving Model At: save_model/best_model.pth

Saving Model At: save_model/best_model.pth

Saving Model At: save_model/best_model.pth

Saving Model At: save_model/best_model.pth

Saving Model At: save_model/best_model.pth

Saving Model At: save_model/best_model.pth

Saving Model At: save_model/best_model.pth

Saving Model At: save_model/best_model.pth

Saving Model At: save_model/best_model.pth

Saving Model At: save_model/best_model.pth

Saving Model At: save_model/best_model.pth

Saving Model At: save_model/best_model.pth

Saving Model At: save_model/best_model.pth

Saving Model At: save_model/best_model.pth

Saving Model At: save_model/best_model.pth

Saving Model At: save_model/best_model.pth

Saving Model At: save_model/best_model.pth
[I 2023-10-23 22:40:28,127] Trial 72 finished with value: 0.584173321723938 and parameters: {'lr': 3.072183458986638e-07, 'n_estimators': 35, 'optimizer': 'Adam'}. Best is trial 72 with value: 0.584173321723938.
[I 2023-10-23 23:21:59,127] Trial 73 finished with value: 0.5868313312530518 and parameters: {'lr': 3.1505289704826233e-07, 'n_estimators': 35, 'optimizer': 'Adam'}. Best is trial 73 with value: 0.5868313312530518.
[I 2023-10-24 00:03:21,470] Trial 74 finished with value: 0.5852217674255371 and parameters: {'lr': 3.37944519125002e-07, 'n_estimators': 35, 'optimizer': 'Adam'}. Best is trial 73 with value: 0.5868313312530518.
[I 2023-10-24 00:28:20,202] Trial 75 finished with value: 0.5888196229934692 and parameters: {'lr': 3.4279797801428923e-07, 'n_estimators': 35, 'optimizer': 'Adam'}. Best is trial 75 with value: 0.5888196229934692.
[I 2023-10-24 01:10:32,472] Trial 76 finished with value: 0.5885568857192993 and parameters: {'lr': 3.7785727396953406e-07, 'n_estimators': 35, 'optimizer': 'Adam'}. Best is trial 75 with value: 0.5888196229934692.
[I 2023-10-24 01:47:41,292] Trial 77 finished with value: 0.5886940956115723 and parameters: {'lr': 3.730182606568301e-07, 'n_estimators': 33, 'optimizer': 'Adam'}. Best is trial 75 with value: 0.5888196229934692.
[I 2023-10-24 02:16:42,436] Trial 78 finished with value: 0.5928004384040833 and parameters: {'lr': 3.98740229310406e-07, 'n_estimators': 33, 'optimizer': 'Adam'}. Best is trial 78 with value: 0.5928004384040833.
[I 2023-10-24 02:54:09,980] Trial 79 finished with value: 0.596867561340332 and parameters: {'lr': 3.951220434815224e-07, 'n_estimators': 32, 'optimizer': 'Adam'}. Best is trial 79 with value: 0.596867561340332.
[I 2023-10-24 03:18:56,660] Trial 80 finished with value: 0.5987726449966431 and parameters: {'lr': 3.9217337610956314e-07, 'n_estimators': 32, 'optimizer': 'Adam'}. Best is trial 80 with value: 0.5987726449966431.
[I 2023-10-24 03:43:56,636] Trial 81 finished with value: 0.6010125279426575 and parameters: {'lr': 3.8983258726821844e-07, 'n_estimators': 33, 'optimizer': 'Adam'}. Best is trial 81 with value: 0.6010125279426575.
[I 2023-10-24 04:12:53,577] Trial 82 finished with value: 0.6015823483467102 and parameters: {'lr': 3.9805005014361763e-07, 'n_estimators': 32, 'optimizer': 'Adam'}. Best is trial 82 with value: 0.6015823483467102.
[I 2023-10-24 05:14:20,760] Trial 83 finished with value: 0.6092749238014221 and parameters: {'lr': 3.988667591679828e-07, 'n_estimators': 32, 'optimizer': 'Adam'}. Best is trial 83 with value: 0.6092749238014221.
[I 2023-10-24 05:38:45,088] Trial 84 finished with value: 0.6045148968696594 and parameters: {'lr': 3.801315324866347e-07, 'n_estimators': 32, 'optimizer': 'Adam'}. Best is trial 83 with value: 0.6092749238014221.
[I 2023-10-24 06:07:41,056] Trial 85 finished with value: 0.6064762473106384 and parameters: {'lr': 3.9351790098082646e-07, 'n_estimators': 32, 'optimizer': 'Adam'}. Best is trial 83 with value: 0.6092749238014221.
[I 2023-10-24 06:36:23,798] Trial 86 finished with value: 0.6090301871299744 and parameters: {'lr': 3.8907654722821625e-07, 'n_estimators': 31, 'optimizer': 'Adam'}. Best is trial 83 with value: 0.6092749238014221.
[I 2023-10-24 07:05:17,713] Trial 87 finished with value: 0.6128934025764465 and parameters: {'lr': 3.7610862993862156e-07, 'n_estimators': 31, 'optimizer': 'Adam'}. Best is trial 87 with value: 0.6128934025764465.
[I 2023-10-24 07:42:09,228] Trial 88 finished with value: 0.6093340516090393 and parameters: {'lr': 3.4982809838009586e-07, 'n_estimators': 30, 'optimizer': 'Adam'}. Best is trial 87 with value: 0.6128934025764465.
[I 2023-10-24 08:19:16,153] Trial 89 finished with value: 0.6141061186790466 and parameters: {'lr': 3.3943441707865654e-07, 'n_estimators': 30, 'optimizer': 'Adam'}. Best is trial 89 with value: 0.6141061186790466.
[I 2023-10-24 08:47:53,069] Trial 90 finished with value: 0.6181385517120361 and parameters: {'lr': 3.415242523802862e-07, 'n_estimators': 30, 'optimizer': 'Adam'}. Best is trial 90 with value: 0.6181385517120361.
[I 2023-10-24 09:16:44,855] Trial 91 finished with value: 0.6147274374961853 and parameters: {'lr': 3.3757698574028605e-07, 'n_estimators': 29, 'optimizer': 'Adam'}. Best is trial 90 with value: 0.6181385517120361.
[I 2023-10-24 09:49:23,877] Trial 92 finished with value: 0.618079423904419 and parameters: {'lr': 3.369688207850333e-07, 'n_estimators': 30, 'optimizer': 'Adam'}. Best is trial 90 with value: 0.6181385517120361.
[I 2023-10-24 10:47:19,401] Trial 93 finished with value: 0.6206730008125305 and parameters: {'lr': 3.333427116728784e-07, 'n_estimators': 30, 'optimizer': 'Adam'}. Best is trial 93 with value: 0.6206730008125305.
[I 2023-10-24 11:24:06,673] Trial 94 finished with value: 0.6197251081466675 and parameters: {'lr': 3.461562208850868e-07, 'n_estimators': 30, 'optimizer': 'Adam'}. Best is trial 93 with value: 0.6206730008125305.
[I 2023-10-24 12:08:51,353] Trial 95 finished with value: 0.6243206262588501 and parameters: {'lr': 3.3584644827281837e-07, 'n_estimators': 30, 'optimizer': 'Adam'}. Best is trial 95 with value: 0.6243206262588501.
[I 2023-10-24 12:33:05,496] Trial 96 finished with value: 0.6249201893806458 and parameters: {'lr': 3.287811197213919e-07, 'n_estimators': 29, 'optimizer': 'Adam'}. Best is trial 96 with value: 0.6249201893806458.
[I 2023-10-24 13:02:04,516] Trial 97 finished with value: 0.6230003237724304 and parameters: {'lr': 3.354841731848597e-07, 'n_estimators': 29, 'optimizer': 'Adam'}. Best is trial 96 with value: 0.6249201893806458.
[I 2023-10-24 13:27:03,953] Trial 98 finished with value: 0.6289621591567993 and parameters: {'lr': 3.241147612310783e-07, 'n_estimators': 26, 'optimizer': 'Adam'}. Best is trial 98 with value: 0.6289621591567993.
[I 2023-10-24 13:52:14,918] Trial 99 finished with value: 0.625308096408844 and parameters: {'lr': 3.287683345694601e-07, 'n_estimators': 26, 'optimizer': 'Adam'}. Best is trial 98 with value: 0.6289621591567993.

Saving Model At: save_model/best_model.pth

Saving Model At: save_model/best_model.pth

Saving Model At: save_model/best_model.pth

Saving Model At: save_model/best_model.pth

Saving Model At: save_model/best_model.pth

Saving Model At: save_model/best_model.pth

Saving Model At: save_model/best_model.pth

Saving Model At: save_model/best_model.pth

Saving Model At: save_model/best_model.pth

Saving Model At: save_model/best_model.pth

Saving Model At: save_model/best_model.pth

Saving Model At: save_model/best_model.pth

Saving Model At: save_model/best_model.pth

Saving Model At: save_model/best_model.pth

Saving Model At: save_model/best_model.pth

Saving Model At: save_model/best_model.pth

Saving Model At: save_model/best_model.pth

Saving Model At: save_model/best_model.pth

Saving Model At: save_model/best_model.pth

Saving Model At: save_model/best_model.pth

Saving Model At: save_model/best_model.pth

Saving Model At: save_model/best_model.pth

Saving Model At: save_model/best_model.pth

Saving Model At: save_model/best_model.pth

Saving Model At: save_model/best_model.pth

Saving Model At: save_model/best_model.pth

Saving Model At: save_model/best_model.pth

Saving Model At: save_model/best_model.pth

Saving Model At: save_model/best_model.pth

Saving Model At: save_model/best_model.pth

Saving Model At: save_model/best_model.pth

Saving Model At: save_model/best_model.pth

Saving Model At: save_model/best_model.pth

Saving Model At: save_model/best_model.pth

Saving Model At: save_model/best_model.pth

Saving Model At: save_model/best_model.pth

Saving Model At: save_model/best_model.pth

Saving Model At: save_model/best_model.pth

Saving Model At: save_model/best_model.pth

Saving Model At: save_model/best_model.pth

Saving Model At: save_model/best_model.pth

Saving Model At: save_model/best_model.pth

Saving Model At: save_model/best_model.pth

Saving Model At: save_model/best_model.pth

Saving Model At: save_model/best_model.pth

Saving Model At: save_model/best_model.pth

Saving Model At: save_model/best_model.pth

Saving Model At: save_model/best_model.pth

Saving Model At: save_model/best_model.pth

Saving Model At: save_model/best_model.pth

Saving Model At: save_model/best_model.pth

Saving Model At: save_model/best_model.pth

Saving Model At: save_model/best_model.pth

Saving Model At: save_model/best_model.pth

Saving Model At: save_model/best_model.pth

Saving Model At: save_model/best_model.pth

Saving Model At: save_model/best_model.pth

Saving Model At: save_model/best_model.pth

Saving Model At: save_model/best_model.pth

Saving Model At: save_model/best_model.pth

Saving Model At: save_model/best_model.pth

Study statistics: 
  Number of finished trials:  100
  Number of pruned trials:  0
  Number of complete trials:  100
Best trial:
  Value:  0.6289621591567993
  Params: 
    lr: 3.241147612310783e-07
    n_estimators: 26
    optimizer: Adam
